{"dataset_id":"readme-showcase-exemplars","index_sha256":"a573213f36764b77c6572557a27a1674fd7617693496ecc0c877c83d55773a48","records":[{"asset":{"kind":"curated","path":"dataset/retrieval/exemplars/curated-01.png","sha256":"c29f9244aa7ded56ad5f645a05341f33d98ea5c5224efda2ad0ea1e10ca64c15"},"record_id":"exemplar-curated-01","split":"train"},{"asset":{"kind":"curated","path":"dataset/retrieval/exemplars/curated-02.png","sha256":"eefae24dad17e2af46a256bdc0eec5c148ce19bf60c8cf37213687155e52b734"},"record_id":"exemplar-curated-02","split":"train"},{"asset":{"kind":"curated","path":"dataset/retrieval/exemplars/curated-03.png","sha256":"7eee6f3c5c84419d782827c6738d5b94cf6df39422cb75a421b668e98da9a3d7"},"record_id":"exemplar-curated-03","split":"train"},{"asset":{"kind":"curated","path":"dataset/retrieval/exemplars/curated-04.png","sha256":"bc8322e0c8cbf1fb2f22d6b7c1b3b3aa8463a75b49d851651b29c456c06e16aa"},"record_id":"exemplar-curated-04","split":"train"},{"asset":{"kind":"curated","path":"dataset/retrieval/exemplars/curated-05.png","sha256":"f34a95511eab9a6120ab000f0b40a7db1fc5652791221414545fbe6cf56b53fa"},"record_id":"exemplar-curated-05","split":"train"},{"asset":{"kind":"curated","path":"dataset/retrieval/exemplars/curated-06.png","sha256":"f1c0a9f5a82260d5eaf87099d6428a2a0c4ccdeba63ffaf27d0c1d10452237b0"},"record_id":"exemplar-curated-06","split":"train"},{"asset":{"kind":"curated","path":"dataset/retrieval/exemplars/curated-07.png","sha256":"8cb0305f5af116a26a2027b2998830a4f0a0431c110008468ac66c43b90fc1ba"},"record_id":"exemplar-curated-07","split":"train"},{"asset":{"kind":"curated","path":"dataset/retrieval/exemplars/curated-08.png","sha256":"7c7d40eb5d896b8836f79308da430e4014565325926f4972c46e6c6ad919e3f4"},"record_id":"exemplar-curated-08","split":"train"},{"asset":{"kind":"curated","path":"dataset/retrieval/exemplars/curated-09.png","sha256":"1e68bdb05dc71c469aa4677e8157f437324ef32765088944e7300953d5571204"},"record_id":"exemplar-curated-09","split":"test"},{"asset":{"kind":"curated","path":"dataset/retrieval/exemplars/curated-10.png","sha256":"38540f36074055db6db414e002fe4f74fc18f0f9997bcb68c6476b7a22fe62b3"},"record_id":"exemplar-curated-10","split":"test"},{"asset":{"kind":"synthetic","path":"dataset/retrieval/exemplars/synthetic-01.svg","sha256":"525a618e4b10223893f11da2824849b476b9c32988c35e30a0a40bbc55591ec8"},"record_id":"exemplar-synthetic-01","split":"train"},{"asset":{"kind":"synthetic","path":"dataset/retrieval/exemplars/synthetic-02.svg","sha256":"9338c61e4d094e66b57f3e3c2825daf42a89cfa195c2feb36c4e4efd6fe4c9e3"},"record_id":"exemplar-synthetic-02","split":"train"},{"asset":{"kind":"synthetic","path":"dataset/retrieval/exemplars/synthetic-03.svg","sha256":"7cd2f8c6662da99b0fe08e522c4935656b5c07b789be8af0de9ed2b1fb7ea569"},"record_id":"exemplar-synthetic-03","split":"train"},{"asset":{"kind":"synthetic","path":"dataset/retrieval/exemplars/synthetic-04.svg","sha256":"34a8fbfb20fe926f5e8ea05562b91056f916ed9a16cda889446a93af6ee7f793"},"record_id":"exemplar-synthetic-04","split":"train"}],"schema_version":1}
