{"dataset_id":"readme-showcase-exemplars","index_sha256":"91e6050dec1f79760a3467e9ddfa15e019ab8cef4a4de3f3b25d44e5e10bccc9","records":[{"asset":{"kind":"curated","path":"dataset/retrieval/exemplars/curated-01.png","sha256":"0000000000000000000000000000000000000000000000000000000000000000"},"record_id":"exemplar-curated-01","split":"train"},{"asset":{"kind":"curated","path":"dataset/retrieval/exemplars/curated-02.png","sha256":"0000000000000000000000000000000000000000000000000000000000000000"},"record_id":"exemplar-curated-02","split":"train"},{"asset":{"kind":"curated","path":"dataset/retrieval/exemplars/curated-03.png","sha256":"0000000000000000000000000000000000000000000000000000000000000000"},"record_id":"exemplar-curated-03","split":"train"},{"asset":{"kind":"curated","path":"dataset/retrieval/exemplars/curated-04.png","sha256":"0000000000000000000000000000000000000000000000000000000000000000"},"record_id":"exemplar-curated-04","split":"train"},{"asset":{"kind":"curated","path":"dataset/retrieval/exemplars/curated-05.png","sha256":"0000000000000000000000000000000000000000000000000000000000000000"},"record_id":"exemplar-curated-05","split":"train"},{"asset":{"kind":"curated","path":"dataset/retrieval/exemplars/curated-06.png","sha256":"0000000000000000000000000000000000000000000000000000000000000000"},"record_id":"exemplar-curated-06","split":"train"},{"asset":{"kind":"curated","path":"dataset/retrieval/exemplars/curated-07.png","sha256":"0000000000000000000000000000000000000000000000000000000000000000"},"record_id":"exemplar-curated-07","split":"train"},{"asset":{"kind":"curated","path":"dataset/retrieval/exemplars/curated-08.png","sha256":"0000000000000000000000000000000000000000000000000000000000000000"},"record_id":"exemplar-curated-08","split":"train"},{"asset":{"kind":"curated","path":"dataset/retrieval/exemplars/curated-09.png","sha256":"0000000000000000000000000000000000000000000000000000000000000000"},"record_id":"exemplar-curated-09","split":"test"},{"asset":{"kind":"curated","path":"dataset/retrieval/exemplars/curated-10.png","sha256":"0000000000000000000000000000000000000000000000000000000000000000"},"record_id":"exemplar-curated-10","split":"test"},{"asset":{"kind":"synthetic","path":"dataset/retrieval/exemplars/synthetic-01.svg","sha256":"0000000000000000000000000000000000000000000000000000000000000000"},"record_id":"exemplar-synthetic-01","split":"train"},{"asset":{"kind":"synthetic","path":"dataset/retrieval/exemplars/synthetic-02.svg","sha256":"0000000000000000000000000000000000000000000000000000000000000000"},"record_id":"exemplar-synthetic-02","split":"train"},{"asset":{"kind":"synthetic","path":"dataset/retrieval/exemplars/synthetic-03.svg","sha256":"0000000000000000000000000000000000000000000000000000000000000000"},"record_id":"exemplar-synthetic-03","split":"train"},{"asset":{"kind":"synthetic","path":"dataset/retrieval/exemplars/synthetic-04.svg","sha256":"0000000000000000000000000000000000000000000000000000000000000000"},"record_id":"exemplar-synthetic-04","split":"train"}],"schema_version":1}
